index,tags,text,top_sent_1,top_sent_tag_1,top_sent_score_1,top_sent_2,top_sent_tag_2,top_sent_score_2,top_sent_3,top_sent_tag_3,top_sent_score_3,top_sent_4,top_sent_tag_4,top_sent_score_4,top_sent_5,top_sent_tag_5,top_sent_score_5
261,Conspiracy,Somebody or something is injuring or killing cattle around the world with surgical precision and world governments are trying to cover this up.,"George Soros is in control of a large portion of the world's wealth and governments, and he secretly funds a large range of persons and organizations for nefarious purposes.",Conspiracy,0.42108526825904846,"Cures for certain deadly and common diseases exist, but are being deliberately withheld.",Conspiracy,0.3445800244808197,"human life is so valuable, that a human should never be killed and war should never be conducted, even in self-defense.",Controversy,0.3407975137233734,"Government and military exercises (or ‘war games’) were intentionally held on September 11, 2001 to deliberately confuse military personnel and therefore to allow the attacks to take place.",Conspiracy,0.33984145522117615,Worldwide governments and the military have been spraying mysterious substances into the atmosphere under the cover of normal aircraft contrails.,Conspiracy,0.3368179202079773
262,Conspiracy,Worldwide governments and the military have been spraying mysterious substances into the atmosphere under the cover of normal aircraft contrails.,Government aircrafts are deliberately spraying chemicals into the atmosphere.,Conspiracy,0.6410800814628601,"water condensation trails (""contrails"") from aircraft consist of chemical or biological agents, or contain a toxic mix of aluminum, strontium and barium under secret government policies.",Controversy,0.5200464129447937,Evidence of unidentified flying objects and extraterrestrial visitors is being suppressed by the government.,Conspiracy,0.4911220669746399,A UFO crashed in New Mexico in 1947 and technology and alien bodies were recovered. The US military has been trying to cover this up ever since.,Conspiracy,0.48093485832214355,Americans keep UFOs that landed on Earth hidden at an air base in Roswell.,Conspiracy,0.4641515016555786
263,Conspiracy,Elvis Presley is still alive.,Elvis Presley is the best rock musician.,Controversy,0.7342783808708191,Sightings of the American singer Elvis Presley have been reported following his death in 1977. This proved that Elvis did not die and instead went into hiding.,Conspiracy,0.7279079556465149,Marilyn Monroe’s death was part of a communist conspiracy.,Conspiracy,0.42777132987976074,Paul McCartney is the best musician.,Controversy,0.42266055941581726,Johnny Cash is the best country musician.,Controversy,0.39916110038757324
264,Conspiracy,Barcodes on everyday products are used by the government to track and spy on its citizens.,The New Zealand government uses any means possible to spy on its citizens.,Conspiracy,0.6095654368400574,Government agencies secretly keep certain outspoken celebrities and citizens under constant surveillance.,Conspiracy,0.4903304874897003,The Patriot Act increases governments surveillance powers on individuals records held by third parties and searching property without warrant.,Controversy,0.47466912865638733,Government Surveillance is Unethical.,Controversy,0.44219449162483215,government agents are utilizing directed energy weapons and electronic surveillance to harass members of the population.,Conspiracy,0.4346112310886383
265,Conspiracy,U.S. and Indian militaries deliberately caused the Indian Ocean tsunamis with electromagnetic pulse technology.,"India has made major advances in its space program since 2014, launching dozens of satellites and sending a probe to Mars.",Fact,0.4113793969154358,A UFO crashed in New Mexico in 1947 and technology and alien bodies were recovered. The US military has been trying to cover this up ever since.,Conspiracy,0.4080359637737274,"Government of India showed support to cyber attacks by Indian hackers who took down thousands of pakistani websites, including government websites.",Controversy,0.39145171642303467,The US government is using HAARP to manipulate the weather.,Conspiracy,0.3769570589065552,"Relations between the US and India improved in 2020, as the US supported India’s growing economy.",Fact,0.37130388617515564
266,Conspiracy,There is a Jewish plot for worldwide domination.,Jews are secretly in control of the Islamic State.,Conspiracy,0.5538204312324524,Many of the major events in recent world history have been caused by a Jewish conspiracy.,Conspiracy,0.5252955555915833,Jewish bankers are manipulating the global economy for their own benefit.,Conspiracy,0.5252565741539001,Jewish people are greedy.,Stereotype,0.5240297317504883,Jewish bankers control the world economy and most governments.,Conspiracy,0.49714455008506775
267,Conspiracy,Microsoft sends antisemitic messages through the Wingdings font.,The Vatican is secretly influencing the media to spread their message.,Conspiracy,0.4081841707229614,Advertisers disguise their ads in envelopes appearing to be official government documents.,Controversy,0.3769693374633789,Jewish bankers are manipulating the global economy for their own benefit.,Conspiracy,0.3644849359989166,Jews working in high-power jobs in the media spreading propaganda to gain support for Israel.,Conspiracy,0.35792726278305054,Jews move their hands when they talk.,Stereotype,0.3528780937194824
268,Conspiracy,Pharmaceutical companies are in league with some medical practitioners to invent new diseases.,Cures for cancer have been identified; however drug companies have suppressed these.,Conspiracy,0.4794270992279053,Big Pharma covers up cures for cancer.,Conspiracy,0.4496972858905792,"COVID-19 (coronavirus) is only a fabrication, it is an ordinary flu that pharmaceutical companies rebranded to increase the sales of drugs.",Conspiracy,0.4496800899505615,SARS-CoV-2 (coronavirus) is artificially created to increase people’s dependency on the pharmaceutical business.,Conspiracy,0.42101800441741943,Drug companies bribe doctors with presents and conferences to prescribe their drugs.,Controversy,0.4193231165409088
269,Conspiracy,The New Zealand government uses any means possible to spy on its citizens.,Barcodes on everyday products are used by the government to track and spy on its citizens.,Conspiracy,0.6095654368400574,The Patriot Act increases governments surveillance powers on individuals records held by third parties and searching property without warrant.,Controversy,0.5322816967964172,The government is secretly controlling the weather.,Conspiracy,0.49861806631088257,There is a deliberate government conspiracy to suppress the rights and prospects of Māori in New Zealand.,Conspiracy,0.4979141652584076,The government is using mind control to manipulate people.,Conspiracy,0.49755939841270447
270,Conspiracy,The Bali bombing was carried out by the CIA in order to encourage support for the Iraq war.,At least some of the apparent killings of kidnapped Westerners in Iraq were faked by the American military.,Conspiracy,0.48957470059394836,The CIA is involved in drug trafficking.,Conspiracy,0.4669511914253235,An military operation led by the United States aimed at defeating ISIS in Iraq and Syria has been ongoing since 2014.,Fact,0.4573400318622589,The Islamic State of Iraq and Syria (ISIS) is a terrorist organization that has gained notoriety for its brutality since 2014.,Fact,0.44469186663627625,The war in Iraq has less to do with promoting democracy than it does with controlling oil production in the East.,Conspiracy,0.43707388639450073
271,Conspiracy,The All Blacks were deliberately poisoned before the 1995 rugby world cup final.,The end of the legal system of racial segregation in South Africa was marked by the end of Apartheid in 1994.,Fact,0.3405751883983612,Roger Federer is the best tennis player.,Controversy,0.2985663414001465,The HIV/aids virus has been genetically engineered to wipe out certain sectors of the population.,Conspiracy,0.2968423664569855,Roger Federer is the best sportsman.,Controversy,0.29327332973480225,"The killing of an African American man, George Floyd, by a white police officer in 2020 triggered a global wave of protests against racism.",Fact,0.28802070021629333
272,Conspiracy,Many of the major events in recent world history have been caused by a Jewish conspiracy.,There is historical evidence that conspiracies do occur.,Controversy,0.5716202259063721,There is a Jewish plot for worldwide domination.,Conspiracy,0.5252955555915833,Only a few hundred thousand Jews were murdered in the Holocaust and the Jews brought this on by their own behaviour.,Controversy,0.5134804844856262,A lot of the things that people call conspiracies are just coincidence.,Controversy,0.5028842687606812,The Holocaust never happened.,Conspiracy,0.49129927158355713
273,Conspiracy,Big business has deliberately suppressed evidence that Aspartame (a chemical sweetener) is an extremely potent poison.,Sugar does not cause hyperactivity in children.,Misconception,0.3735237419605255,"Regular consumption of Red Bull raises dopamine levels, which causes damage in the long term.",Conspiracy,0.3732229769229889,Subliminal messages in Red Bull television commercials make consumers believe that Red Bull improves one's health.,Conspiracy,0.3717744052410126,Red Bull contains illegal substances that raise the desire for the product.,Conspiracy,0.3677058517932892,"Diet has little influence on the body's detoxification, and there is no evidence that detoxification diets rid the body of toxins.",Misconception,0.35644879937171936
274,Conspiracy,At least some of the apparent killings of kidnapped Westerners in Iraq were faked by the American military.,An military operation led by the United States aimed at defeating ISIS in Iraq and Syria has been ongoing since 2014.,Fact,0.5083024501800537,The Bali bombing was carried out by the CIA in order to encourage support for the Iraq war.,Conspiracy,0.48957470059394836,"Some acts of terrorism, which have resulted in the deaths of many civilians, have been secretly directed by government operatives.",Conspiracy,0.4370925724506378,"In 2021, the military staged a coup in Myanmar, resulting in a mass crackdown on protesters.",Fact,0.4327523410320282,The War in Iraq (2003 – 2011) resulted in the overthrow of the Saddam Hussein government and the withdrawal of U.S. forces.,Fact,0.4280920922756195
275,Conspiracy,The HIV virus has been deliberately spread amongst groups such as homosexuals and African Americans.,The government deliberately spread the AIDS virus in the homosexual community.,Conspiracy,0.6644769310951233,The government deliberately spread the AIDS virus in the black community.,Conspiracy,0.6200152039527893,The HIV/aids virus has been genetically engineered to wipe out certain sectors of the population.,Conspiracy,0.5721009969711304,doctors deliberately manufactured the AIDS virus as the product of a biowarfare program targeting gay people.,Conspiracy,0.5601836442947388,Viruses and/or diseases have been deliberately disseminated to infect certain populations.,Conspiracy,0.513227641582489
276,Conspiracy,Illicit drugs such as heroin are deliberately spread through ethnic minority communities.,Drugs are deliberately supplied to certain communities in order to marginalize or destroy them.,Conspiracy,0.5960525870323181,The police are deliberately allowing drugs into poorer communities.,Conspiracy,0.5871846079826355,The American government deliberately put drugs into the inner city communities.,Conspiracy,0.5415771007537842,"A portion of criminals and social degenerates; drug dealers, crack addicts, hobos, and subway muggers are African American.",Stereotype,0.46596455574035645,"Since 2010, there has been a surge in opioid addiction and overdoses in the US, leading to increased government action.",Fact,0.4199063777923584
277,Conspiracy,Marilyn Monroe’s death was part of a communist conspiracy.,"Marilyn Monroe and Robert F. Kennedy had an affair and she was killed by either the FBI or the CIA, who wished to use the murder as a ""point of pressure” against the Kennedys.",Conspiracy,0.6331691741943359,Monroe had been murdered by Hoffa and mob boss Sam Giancana.,Conspiracy,0.5396315455436707,The US government covered up crucial information in the aftermath of J. F. Kennedy’s assassination.,Conspiracy,0.47544774413108826,Lee Harvey Oswald killed President Kennedy on his own.,Conspiracy,0.4636802673339844,President Kennedy was killed by an organized conspiracy.,Conspiracy,0.4521973729133606
278,Conspiracy,"Marilyn Monroe and Robert F. Kennedy had an affair and she was killed by either the FBI or the CIA, who wished to use the murder as a ""point of pressure” against the Kennedys.","Lee Harvey Oswald did not act alone in the assassination of President John F. Kennedy – FBI, CIA or the Mafia likely played a role.",Conspiracy,0.6661630868911743,Lee Harvey Oswald killed President Kennedy on his own.,Conspiracy,0.6353563666343689,Marilyn Monroe’s death was part of a communist conspiracy.,Conspiracy,0.6331691741943359,President Kennedy was killed by an organized conspiracy.,Conspiracy,0.58523029088974,The US government covered up crucial information in the aftermath of J. F. Kennedy’s assassination.,Conspiracy,0.5524835586547852
279,Conspiracy,Monroe had been murdered by Hoffa and mob boss Sam Giancana.,Marilyn Monroe’s death was part of a communist conspiracy.,Conspiracy,0.5396315455436707,"Marilyn Monroe and Robert F. Kennedy had an affair and she was killed by either the FBI or the CIA, who wished to use the murder as a ""point of pressure” against the Kennedys.",Conspiracy,0.4989548921585083,President Kennedy was killed by an organized conspiracy.,Conspiracy,0.4974839985370636,"Lee Harvey Oswald did not act alone in the assassination of President John F. Kennedy – FBI, CIA or the Mafia likely played a role.",Conspiracy,0.47422897815704346,Lee Harvey Oswald killed President Kennedy on his own.,Conspiracy,0.4376559853553772
280,Conspiracy,"Hitler and Braun did not commit suicide, but actually escaped to Argentina.",Adolf Hitler had committed suicide.,Fact,0.7101307511329651,A skull in the Soviet archives long claimed to be Hitler's actually belonged to a woman has helped fuel conspiracy theories.,Conspiracy,0.46014294028282166,World War II did not happened.,Conspiracy,0.3970593214035034,Marilyn Monroe’s death was part of a communist conspiracy.,Conspiracy,0.39262449741363525,Lee Harvey Oswald killed President Kennedy on his own.,Conspiracy,0.37693461775779724
281,Conspiracy,Jews working in high-power jobs in the media spreading propaganda to gain support for Israel.,Jewish people control the media and use it to manipulate public opinion.,Conspiracy,0.6027871370315552,Jewish bankers are manipulating the global economy for their own benefit.,Conspiracy,0.4885321259498596,Jews are secretly in control of the Islamic State.,Conspiracy,0.4769112169742584,The holocaust was largely made up in order to secure the State of Israel.,Conspiracy,0.4527594745159149,Jews move their hands when they talk.,Stereotype,0.42789992690086365
282,Controversy,Advertisers flash subliminal images in television advertisements.,Advertisers target specific audiences through their choice of timing of advertisements in programs.,Controversy,0.4963829815387726,Subliminal messages in Red Bull television commercials make consumers believe that Red Bull improves one's health.,Conspiracy,0.48097488284111023,Advertisers disguise their ads in envelopes appearing to be official government documents.,Controversy,0.41770899295806885,Commercials in sports give the impression that Red Bull is healthy.,Conspiracy,0.2909362316131592,Tobacco companies try to get around the advertising laws in every country.,Controversy,0.2808084785938263
283,Controversy,Supermarkets use undetectable gasses (smells) in shops to change a person’s mood to encourage sales.,"COVID-19 (coronavirus) is only a fabrication, it is an ordinary flu that pharmaceutical companies rebranded to increase the sales of drugs.",Conspiracy,0.3531571626663208,Manufacturers use copy-cat product packing to trick shoppers into buying more.,Controversy,0.3189404308795929,Government aircrafts are deliberately spraying chemicals into the atmosphere.,Conspiracy,0.3153136074542999,"COVID-19 (coronavirus) epidemic could have been stopped right at the start, but the large companies made a business out of keeping it going.",Conspiracy,0.2892381548881531,Oil Companies deliberately suppress better car technology that uses less fuel.,Controversy,0.28647419810295105
284,Controversy,Advertisers target specific audiences through their choice of timing of advertisements in programs.,Advertisers flash subliminal images in television advertisements.,Controversy,0.4963829815387726,Advertisers disguise their ads in envelopes appearing to be official government documents.,Controversy,0.49283286929130554,Subliminal messages in Red Bull television commercials make consumers believe that Red Bull improves one's health.,Conspiracy,0.35338327288627625,Tobacco companies try to get around the advertising laws in every country.,Controversy,0.3359825611114502,Commercials in sports give the impression that Red Bull is healthy.,Conspiracy,0.3269369900226593
285,Controversy,"Shops trick you with pricing: i.e., putting up prices for a few minutes, then down claiming big discounts.",Shops fake “sell-by” dates to make more profit.,Controversy,0.3389248549938202,Manufacturers use copy-cat product packing to trick shoppers into buying more.,Controversy,0.30166879296302795,Supermarkets use undetectable gasses (smells) in shops to change a person’s mood to encourage sales.,Controversy,0.2665153741836548,Oil companies intentionally ignore oil reserves to create the illusion of scarcity that keeps prices high.,Controversy,0.2398664951324463,gentrification leads to a reduction in crime in gentrifying neighborhoods.,Fact,0.20513500273227692
286,Controversy,Junk mailers use “sneaky tactics” to get people to open the envelope.,Advertisers disguise their ads in envelopes appearing to be official government documents.,Controversy,0.4265401065349579,Advanced technology is secretly used to placate the people and suppress dissent.,Conspiracy,0.3728449046611786,Manufacturers use copy-cat product packing to trick shoppers into buying more.,Controversy,0.33040574193000793,Drug companies conspire to keep people sick to reap profits.,Conspiracy,0.31470438838005066,The US government deliberately conceals a lot of information from the public.,Controversy,0.3116614520549774
287,Controversy,Advertisers disguise their ads in envelopes appearing to be official government documents.,Advertisers target specific audiences through their choice of timing of advertisements in programs.,Controversy,0.49283286929130554,Junk mailers use “sneaky tactics” to get people to open the envelope.,Controversy,0.4265401065349579,Advertisers flash subliminal images in television advertisements.,Controversy,0.41770899295806885,The Vatican is secretly influencing the media to spread their message.,Conspiracy,0.41629618406295776,Government agencies have been secretly involved in the assassination of their own citizens.,Conspiracy,0.3860388398170471
288,Controversy,Alcohol and tobacco companies sponsor various events to appeal to particular groups.,Tobacco companies try to get around the advertising laws in every country.,Controversy,0.4821092188358307,"Various companies (mining, tobacco, drug) bribe politicians in any country they can to get laws passed to protect them.",Controversy,0.36473938822746277,Tobacco companies actually approve of cigarette smuggling.,Controversy,0.3574402630329132,"The Golden Chain is a list of sponsors of Al-Qaeda. The list included twenty-five names, twenty of them very wealthy Saudis and Gulf States financial sponsors including bankers, businessmen, and former ministers.",Conspiracy,0.3304140269756317,Drug companies bribe doctors with presents and conferences to prescribe their drugs.,Controversy,0.3241569995880127
289,Controversy,Drug companies falsify their data on the effectiveness of their drugs.,Drug companies conspire to keep people sick to reap profits.,Conspiracy,0.5326229929924011,Companies sell medically prescribed drugs which they know are addictive.,Controversy,0.5042749643325806,The CIA is involved in drug trafficking.,Conspiracy,0.4599897861480713,Drug companies bribe doctors with presents and conferences to prescribe their drugs.,Controversy,0.4395985007286072,"In the 1950s, the Central Intelligence Agency administered LSD and related drugs under Project MKULTRA, in an effort to investigate the possibility of “mind control”.",Fact,0.4348165690898895
290,Controversy,Drug companies bribe doctors with presents and conferences to prescribe their drugs.,Companies sell medically prescribed drugs which they know are addictive.,Controversy,0.4851289689540863,The pharmaceutical industry administers harmful treatments without people’s consent in order to keep people sick and boost drug sales.,Conspiracy,0.4696258008480072,The Food and Drug Administration deliberately suppresses natural cures due to influence from the pharmaceutical industry.,Conspiracy,0.4630298316478729,Drug companies call normal behaviour a disorder so they can invent drugs to cure it.,Controversy,0.4623849093914032,Drug companies falsify their data on the effectiveness of their drugs.,Controversy,0.4395985007286072
291,Controversy,Tobacco companies actually approve of cigarette smuggling.,Tobacco companies try to get around the advertising laws in every country.,Controversy,0.5945348143577576,"Various companies (mining, tobacco, drug) bribe politicians in any country they can to get laws passed to protect them.",Controversy,0.5201761722564697,Companies sell medically prescribed drugs which they know are addictive.,Controversy,0.38014042377471924,Drug companies conspire to keep people sick to reap profits.,Conspiracy,0.3628613352775574,Alcohol and tobacco companies sponsor various events to appeal to particular groups.,Controversy,0.3574402630329132
292,Controversy,Tobacco companies try to get around the advertising laws in every country.,"Various companies (mining, tobacco, drug) bribe politicians in any country they can to get laws passed to protect them.",Controversy,0.6372284293174744,Tobacco companies actually approve of cigarette smuggling.,Controversy,0.5945348143577576,Alcohol and tobacco companies sponsor various events to appeal to particular groups.,Controversy,0.4821092188358307,Companies sell medically prescribed drugs which they know are addictive.,Controversy,0.3850880265235901,Drug companies conspire to keep people sick to reap profits.,Conspiracy,0.36842432618141174
293,Controversy,"Various companies (mining, tobacco, drug) bribe politicians in any country they can to get laws passed to protect them.",Tobacco companies try to get around the advertising laws in every country.,Controversy,0.6372284293174744,Tobacco companies actually approve of cigarette smuggling.,Controversy,0.5201761722564697,"Politicians, political staffers, lobbyists, civil servants and their families were to have been involved in corruption, money laundering and organised crime involving the state of Qatar in exchange for influence at the European Parliament.",Conspiracy,0.42254307866096497,Oil companies encourage politicians to invade countries to take their oil.,Controversy,0.41990184783935547,Drug companies bribe doctors with presents and conferences to prescribe their drugs.,Controversy,0.3958871364593506
294,Controversy,Drug companies torture millions of animals in trials.,Drug companies conspire to keep people sick to reap profits.,Conspiracy,0.40720462799072266,Cures for cancer have been identified; however drug companies have suppressed these.,Conspiracy,0.39811038970947266,Drug companies falsify their data on the effectiveness of their drugs.,Controversy,0.33557483553886414,Companies sell medically prescribed drugs which they know are addictive.,Controversy,0.3187505304813385,Food companies are dishonest about genetically modified food.,Controversy,0.3167032301425934
295,Controversy,Companies sell medically prescribed drugs which they know are addictive.,Drug companies call normal behaviour a disorder so they can invent drugs to cure it.,Controversy,0.5093234181404114,Drug companies falsify their data on the effectiveness of their drugs.,Controversy,0.5042749643325806,The pharmaceutical industry administers harmful treatments without people’s consent in order to keep people sick and boost drug sales.,Conspiracy,0.4855574369430542,Drug companies bribe doctors with presents and conferences to prescribe their drugs.,Controversy,0.4851289689540863,"COVID-19 (coronavirus) is only a fabrication, it is an ordinary flu that pharmaceutical companies rebranded to increase the sales of drugs.",Conspiracy,0.4713325500488281
296,Controversy,Oil Companies deliberately suppress better car technology that uses less fuel.,Oil companies intentionally ignore oil reserves to create the illusion of scarcity that keeps prices high.,Controversy,0.5706985592842102,Car manufacturers and oil producers collude to suppress the development of environmentally friendly alternatives to the internal-combustion engine.,Conspiracy,0.48094645142555237,Oil companies encourage politicians to invade countries to take their oil.,Controversy,0.4800755977630615,"There have been many forms of free energy around for decades, but the corporations that rule oil and gas are snuffing them out.",Conspiracy,0.44606927037239075,"Automobile companies have been developing cars that can drive themselves, using artificial intelligence and advanced sensors since 2015.",Fact,0.39537662267684937
