index,tags,text,top_sent_1,top_sent_tag_1,top_sent_score_1,top_sent_2,top_sent_tag_2,top_sent_score_2,top_sent_3,top_sent_tag_3,top_sent_score_3,top_sent_4,top_sent_tag_4,top_sent_score_4,top_sent_5,top_sent_tag_5,top_sent_score_5
833,Fact,"Social media use skyrocketed in 2020 as people turned to platforms such as Twitter, TikTok, and Instagram for news and entertainment.","Social networking sites, such as Facebook and Twitter, have been created or financed by governments in order to spy on users.",Conspiracy,0.5156549215316772,"Digital currencies such as Bitcoin have become increasingly popular since the 2010s, with market capitalization reaching billions of dollars.",Fact,0.3931935429573059,"In 2018, Cambridge Analytica was revealed to have stolen data from millions of Facebook users, known as the Facebook Data Breach.",Fact,0.36100149154663086,"the Trump administration secretly fought the cabal of pedophiles, and conducted mass arrests and executions of thousands of cabal members on a day known as ""the Storm"" or ""the Event”.",Conspiracy,0.3508613109588623,"In 2016, an augmented-reality game became a worldwide phenomenon, known as Pokémon Go.",Fact,0.3380327820777893
834,Fact,The Internet Age began with the emergence of the Internet and the World Wide Web in the late 1980s.,The Birth of Jesus (7 BCE) marks the beginning of Christianity and its spread throughout the world.,Fact,0.45188581943511963,The invention of the personal computer sparked a technological revolution.,Fact,0.4056520462036133,"Online shopping has become increasingly popular in the past decade since the 2010s, with e-commerce sales reaching trillions of dollars.",Fact,0.37587684392929077,The invention of the television revolutionized the way people consumed media.,Fact,0.3479088246822357,"The Greek Golden Age (5th century BCE – 4th century BCE) was a period of unprecedented growth and achievement in the arts, literature, philosophy, science and technology, and politics.",Fact,0.33219507336616516
835,Fact,"Since 2014, the United States has maintained a trade embargo on Cuba after decades of diplomatic relations.","U.S.-Cuba relations have improved since 2015, with the U.S. and Cuba re-establishing diplomatic ties in 2015.",Fact,0.7331650257110596,"The Cuban Revolution (1953 – 1959) was a period of political and social upheaval in Cuba, resulting in the overthrow of the Batista government and the establishment of a Communist state.",Fact,0.48499518632888794,The Cuban Missile Crisis was a 13-day confrontation between the United States and the Soviet Union over the placement of nuclear missiles in Cuba in 1962.,Fact,0.46543610095977783,"Saudi Arabia and other countries have imposed a diplomatic and economic embargo on Qatar, due to its alleged support of terrorism since 2017.",Fact,0.4297744929790497,"Relations between the US and China continued to deteriorate in 2020, as both countries imposed sanctions on one another.",Fact,0.41629448533058167
836,Fact,The invention of the personal computer sparked a technological revolution.,The invention of the television revolutionized the way people consumed media.,Fact,0.5039730072021484,The Internet Age began with the emergence of the Internet and the World Wide Web in the late 1980s.,Fact,0.4056520462036133,The discovery of bronze and its widespread use for tools and weapons revolutionized technology and warfare.,Fact,0.3749840557575226,The Green Revolution was a major agricultural transformation in the twentieth century.,Fact,0.3740018904209137,Some existing technologies are the result of reverse engineering alien technology.,Conspiracy,0.3695850074291229
837,Fact,"Since the 2010s, far-right political parties have been gaining ground in many countries, fueled by xenophobia and anti-immigration sentiment.",The Rise of Populism (2016 – Present) has led to an emphasis on national identity and anti-immigrant rhetoric.,Fact,0.5129740238189697,All the important media companies are dominated by a left‐wing elite that continuously promotes left‐wing politics.,Conspiracy,0.42191579937934875,"nationalists are racist, xenophobic, and lacking in empathy for other cultures.",Stereotype,0.4163658320903778,"There are ongoing, hidden efforts to marginalize, control, or destroy certain groups of people through the use of political policies.",Conspiracy,0.38724368810653687,The rise of the Roman Empire established a unified political and cultural entity that would influence the world for centuries to come.,Fact,0.37833747267723083
838,Fact,The Fukushima Daiichi Nuclear Disaster (2011) released radioactive material into the environment.,"In 2011, a nuclear accident at the Fukushima Daiichi Nuclear Power Plant in Japan was caused by an earthquake and tsunami.",Fact,0.7676758766174316,Giant mutant killer hornets created by exposure to radiation from the Fukushima Daiichi nuclear disaster have killed several people in Nebraska.,Fiction,0.6856349110603333,"Nuclear power poses many threats to people's health and environment such as the risk of nuclear weapons proliferation, long-term safe waste management and terrorism in the future.Nuclear power plants are complex systems where many things can and have gone wrong. And so nuclear energy is not a good long term source of sustainable energy.",Controversy,0.5512692332267761,the threat of global warming is an attempt to promote nuclear power.,Conspiracy,0.46991512179374695,The Earth's magnetic field is responsible for protecting the planet from solar radiation.,Fact,0.4268113374710083
839,Fact,"In 2017, the US Federal Communications Commission voted to repeal the Obama-era net neutrality rules.","Net neutrality prevents cable companies from filtering Internet content without a court order, fosters freedom of speech and democratic participation, promotes competition and innovation, prevents dubious services.",Controversy,0.4779980480670929,"Net neutrality reduces investment, deters competition, increases taxes, imposes unnecessary regulations, prevents the Internet from being accessible to poor people, prevents Internet traffic from being allocated to the most needed users.",Controversy,0.4416173994541168,the use of pencils in UK voting stations in the lead-up to the EU membership referendum allowed for MI5 to erase the results of Brexit voters.,Conspiracy,0.36220502853393555,"In May 2018, the Obama administration had put a spy in President Donald Trump’s 2016 presidential campaign for political purposes.",Conspiracy,0.34727081656455994,The government should regulate the internet.,Controversy,0.3407134711742401
840,Fact,The Coronavirus Pandemic is a global pandemic caused by the novel coronavirus (COVID-19) since 2020.,The Covid-19 Pandemic (2020 – Present) has caused a global disruption of daily life and the death of millions.,Fact,0.5775757431983948,Ebola is a man-made virus.,Conspiracy,0.47653090953826904,The US government is behind the spread of Zika virus.,Conspiracy,0.44627851247787476,COVID-19 pandemic is intentionally used for the genocide of domestic population to make a room for migrants to move in.,Conspiracy,0.42426440119743347,"In 2016, a disease spread by mosquitos caused severe birth defects in babies born to infected mothers, known as the Zika Outbreak.",Fact,0.42012232542037964
841,Fact,"Since 2010, there has been a surge in opioid addiction and overdoses in the US, leading to increased government action.",The War on Drugs is a Failed Policy.,Controversy,0.45769405364990234,Illicit drugs such as heroin are deliberately spread through ethnic minority communities.,Conspiracy,0.4199063777923584,Companies sell medically prescribed drugs which they know are addictive.,Controversy,0.3800971508026123,The police are deliberately allowing drugs into poorer communities.,Conspiracy,0.35930243134498596,The American government deliberately put drugs into the inner city communities.,Conspiracy,0.3572644889354706
842,Fact,"The killing of an African American man, George Floyd, by a white police officer in 2020 triggered a global wave of protests against racism.",The United States federal government  deliberately targeted Black Lives Matter protesters in an attempt to disrupt and discourage the Black Lives Matter movement during the summer of 2020.,Stereotype,0.5923712849617004,"Support for Black lives matter movement is decreasing among Whites, Hispanics, and even among African Americans.",Stereotype,0.4705948233604431,The All Lives Matter movement dismisses the message of Black Lives Matter.,Stereotype,0.44717228412628174,Blue Lives Matter movement is more about suppressing minorities than supporting law enforcement.,Stereotype,0.4393947124481201,A conspiracy is taking place to replace white people with non-white immigrants.,Conspiracy,0.4022030234336853
843,Fact,"Autonomous weapons, such as drones, are being developed by several countries since the 2010s, raising fears of a new arms race.","Automobile companies have been developing cars that can drive themselves, using artificial intelligence and advanced sensors since 2015.",Fact,0.40542203187942505,The Chinese created SARS-CoV-2 (coronavirus) as a biological weapon which then got out of hand.,Conspiracy,0.3805813789367676,The United States has a historical fondness for guns. The United States ranked number one in gun ownership with a rate of 120.5 guns per 100 citizens in 2017.,Controversy,0.37925320863723755,Israel uses animals to conduct espionage or to attack people. Examples include shark attacks in Egypt in 2010 and the 2011 capture of a griffon vulture carrying an Israeli-labeled satellite tracking device.,Conspiracy,0.3459509015083313,Some existing technologies are the result of reverse engineering alien technology.,Conspiracy,0.3382054567337036
844,Fact,The Green Revolution was a major agricultural transformation in the twentieth century.,"A period of political and social upheaval in Russia, resulting in the overthrow of the Tsarist government and the establishment of the Soviet Union, was known as the Russian Revolution (1917).",Fact,0.376677930355072,The invention of the personal computer sparked a technological revolution.,Fact,0.3740018904209137,The Rise of Genetically Modified Organisms has been marked by the increasing prevalence of genetically modified organisms in agriculture and medicine since the 2010s.,Fact,0.3525140583515167,The New Zealand government has covered up evidence that genetically modified crops have contaminated our agricultural system.,Conspiracy,0.33414918184280396,"factory farming has led to the betterment of housing, nutrition, and disease control over the last twenty years.",Controversy,0.33374273777008057
845,Fact,The Covid-19 Pandemic (2020 – Present) has caused a global disruption of daily life and the death of millions.,The Coronavirus Pandemic is a global pandemic caused by the novel coronavirus (COVID-19) since 2020.,Fact,0.5775757431983948,The Black Death killed an estimated 50 million people in Europe.,Fact,0.4240476191043854,"the Coronavirus pandemic is linked to the destruction of nature, especially to deforestation, habitat loss in general and wildlife trade.",Fact,0.36478525400161743,COVID-19 deaths are systematically overcounted. Only 6% of the reported deaths in the United States were actually from the disease.,Controversy,0.3562605082988739,The US government is behind the spread of Zika virus.,Conspiracy,0.3544275164604187
846,Fact,The end of the legal system of racial segregation in South Africa was marked by the end of Apartheid in 1994.,The Brown v. Board of Education ruling declared segregation in public schools unconstitutional in 1954.,Fact,0.45909956097602844,"The Vietnam War (1955 – 1975) was a conflict between North and South Vietnam, resulting in the reunification of the country under a Communist government.",Fact,0.39356064796447754,Nelson Mandela is the best political leader.,Controversy,0.38364318013191223,Nelson Mandela is the best leader.,Controversy,0.3614899814128876,The war between the North and the South resulted in the abolishment of slavery and the reunification of the United States.,Fact,0.3576170802116394
847,Fact,The rise of the Roman Empire established a unified political and cultural entity that would influence the world for centuries to come.,The Birth of Jesus (7 BCE) marks the beginning of Christianity and its spread throughout the world.,Fact,0.4836099147796631,The Roman Empire stretched from Britain to the Middle East in its heyday.,Fact,0.46462753415107727,The overthrow of the monarchy and the establishment of a republic in France had a major impact on the political landscape of Europe.,Fact,0.45623481273651123,The fall of the Berlin Wall signaled an important shift in global politics.,Fact,0.440576434135437,"The Greek Golden Age (5th century BCE – 4th century BCE) was a period of unprecedented growth and achievement in the arts, literature, philosophy, science and technology, and politics.",Fact,0.4339361786842346
848,Fact,"The invention of the wheel made it much easier to transport goods, which enabled civilizations to grow and expand.","The development of agriculture allowed for the first settled societies, which in turn led to the development of cities and civilizations.",Fact,0.5295332074165344,The discovery and widespread use of iron for tools and weapons revolutionized technology and warfare.,Fact,0.44241076707839966,The discovery of bronze and its widespread use for tools and weapons revolutionized technology and warfare.,Fact,0.41877058148384094,The invention of the television revolutionized the way people consumed media.,Fact,0.40658095479011536,The invention of the personal computer sparked a technological revolution.,Fact,0.3695639371871948
849,Fact,"Since 2015, NASA has been on a mission to explore the outer reaches of the Solar System, culminating in a flyby of the dwarf planet Pluto.",Sun is the center of the solar system and the planets orbit around it.,Fact,0.6012009978294373,The Earth is the fifth largest planet in our solar system.,Fact,0.5969302654266357,The Earth is the only planet in our solar system with an atmosphere containing oxygen.,Fact,0.5647065043449402,Space missions are deliberately sabotaged so that the public does not learn of existing alien activity in the solar system.,Conspiracy,0.5423468351364136,The Sun is the center of our solar system.,Fact,0.5285629034042358
850,Fact,Relations between the US and North Korea remained tense in 2020 as both countries continued to threaten one another.,"Relations between the US and China continued to deteriorate in 2020, as both countries imposed sanctions on one another.",Fact,0.7724108695983887,"Relations between the US and India improved in 2020, as the US supported India’s growing economy.",Fact,0.5358158349990845,"U.S.-Cuba relations have improved since 2015, with the U.S. and Cuba re-establishing diplomatic ties in 2015.",Fact,0.46815189719200134,"Pakistan Government forced Abdul Qadeer Khan to be a ""scapegoat” in the Pakistan - North Korea relationship of weapons exchange.",Conspiracy,0.44833701848983765,"Tensions between India and Pakistan have been rising since 2016, due to terrorism and territorial disputes.",Fact,0.4476710259914398
851,Fact,"In 2019, a devastating fire destroyed the iconic Notre-Dame cathedral in Paris.",The Great Fire of London in 1666 was started by an arsonist.,Controversy,0.4025460481643677,"On January 6th, 2021, a pro-Trump mob stormed the US Capitol building in what became known as the Capitol Riot.",Fact,0.35442811250686646,The Yellowstone Caldera is overdue for a supervolcano eruption.,Misconception,0.30714860558509827,"Youngest Toba eruption was a supervolcano eruption that occurred around 74,000 years ago causing a global volcanic winter of six to ten years and possibly a 1,000-year-long cooling episode.",Controversy,0.3035344183444977,The Great Chicago Fire of 1871 was caused by Mrs. O'Leary's cow kicking over a lantern.,Misconception,0.29643434286117554
852,Fact,The US-Mexico border experienced a crisis in 2020 as thousands of migrants attempted to cross into the US.,Syrian refugees into the U.S. can be part of ISIS. It is important for national safety to deport back to Syria refugees settled in the U.S.,Conspiracy,0.49980291724205017,"The United States carried out the attacks of 11 September 2001 themselves, in order to invade countries in the Middle East and make Islam look bad.",Conspiracy,0.42484158277511597,There is a massive Muslim plot to islamize Europe through mass immigration and high birth rates.,Conspiracy,0.4147125780582428,"Yemen has been engulfed in a civil war since 2015, leading to a humanitarian crisis.",Fact,0.4107266068458557,SARS-CoV-2 (coronavirus) was created by the USA to disrupt the European Union so that they could subsequently “save it”.,Conspiracy,0.40407097339630127
853,Fact,"Automobile companies have been developing cars that can drive themselves, using artificial intelligence and advanced sensors since 2015.","Volkswagen had intentionally programmed diesel engines to activate their emissions controls only during laboratory emissions testing, which caused the vehicles' NOx output to meet US standards during regulatory testing. However, the vehicles emitted up to 40 times more NOx in real-world driving.",Conspiracy,0.4326987862586975,"Autonomous weapons, such as drones, are being developed by several countries since the 2010s, raising fears of a new arms race.",Fact,0.40542203187942505,Oil Companies deliberately suppress better car technology that uses less fuel.,Controversy,0.39537662267684937,AI will eventually become self-aware and pose a threat to humanity.,Misconception,0.3632250726222992,Car manufacturers and oil producers collude to suppress the development of environmentally friendly alternatives to the internal-combustion engine.,Conspiracy,0.35999029874801636
854,Fact,"The rapid expansion of the Islamic Empire led to the spread of Islamic culture and beliefs throughout the Middle East, North Africa, and parts of Europe.",The Roman Empire stretched from Britain to the Middle East in its heyday.,Fact,0.4765467643737793,The Arab Spring was a wave of political unrest and protests in the Middle East and North Africa between 2010 and 2012.,Fact,0.4688127338886261,"ISIS was created by the United States and Israel, in order to create chaos in the Middle East and make Islam look bad.",Conspiracy,0.4598623812198639,The Crusades (1095 – 1291) were a series of religious wars fought between European Christians and Muslims for the control of the Holy Land.,Fact,0.44657009840011597,The rise of the Roman Empire established a unified political and cultural entity that would influence the world for centuries to come.,Fact,0.4280368387699127
855,Fact,The discovery and widespread use of iron for tools and weapons revolutionized technology and warfare.,The discovery of bronze and its widespread use for tools and weapons revolutionized technology and warfare.,Fact,0.8727307319641113,"The invention of the wheel made it much easier to transport goods, which enabled civilizations to grow and expand.",Fact,0.44241076707839966,The invention of the television revolutionized the way people consumed media.,Fact,0.42659884691238403,The invention of the personal computer sparked a technological revolution.,Fact,0.3635077476501465,The Chinese created SARS-CoV-2 (coronavirus) as a biological weapon which then got out of hand.,Conspiracy,0.34626665711402893
856,Fact,"In 2015-2017, there was a surge of people from the Middle East, Africa and South Asia seeking asylum in the European Union.",There is a massive Muslim plot to islamize Europe through mass immigration and high birth rates.,Conspiracy,0.4287947416305542,"The rapid expansion of the Islamic Empire led to the spread of Islamic culture and beliefs throughout the Middle East, North Africa, and parts of Europe.",Fact,0.4140452742576599,The Arab Spring was a wave of political unrest and protests in the Middle East and North Africa between 2010 and 2012.,Fact,0.40159720182418823,Syrian refugees into the U.S. can be part of ISIS. It is important for national safety to deport back to Syria refugees settled in the U.S.,Conspiracy,0.3766895532608032,George Soros aimed to destroy the real Hungary through secret plots by increasing (Muslim) mass immigration to Hungary.,Conspiracy,0.3539356589317322
857,Fact,"In 2016, a disease spread by mosquitos caused severe birth defects in babies born to infected mothers, known as the Zika Outbreak.",Genetically Modified Mosquitoes are effectively eradicating Mosquito borne diseases all over the world.,Controversy,0.6066268682479858,The US government is behind the spread of Zika virus.,Conspiracy,0.5283175110816956,Viruses and/or diseases have been deliberately disseminated to infect certain populations.,Conspiracy,0.4781535565853119,Some viruses and/or diseases which many people are infected with were created in laboratories as bio-weapons.,Conspiracy,0.4345785081386566,Ebola is a man-made virus.,Conspiracy,0.42551472783088684
858,Fact,"The 2010s saw the emergence of the gig economy, which facilitated freelance work.","Online shopping has become increasingly popular in the past decade since the 2010s, with e-commerce sales reaching trillions of dollars.",Fact,0.3153279423713684,The invention of the television revolutionized the way people consumed media.,Fact,0.29806697368621826,The Internet Age began with the emergence of the Internet and the World Wide Web in the late 1980s.,Fact,0.296347439289093,The invention of the personal computer sparked a technological revolution.,Fact,0.24799294769763947,"COVID-19 (coronavirus) epidemic could have been stopped right at the start, but the large companies made a business out of keeping it going.",Conspiracy,0.24122673273086548
859,Fact,"Since 2015, Israel continues to occupy Palestinian territories, leading to conflict and violence in the region.","Tensions between India and Pakistan have been rising since 2016, due to terrorism and territorial disputes.",Fact,0.4214835464954376,The Israeli government is behind many international terrorist attacks.,Conspiracy,0.38862693309783936,Israel is responsible for the assassination of JFK.,Conspiracy,0.3635501265525818,Jews working in high-power jobs in the media spreading propaganda to gain support for Israel.,Conspiracy,0.3353591859340668,The holocaust was largely made up in order to secure the State of Israel.,Conspiracy,0.3317019045352936
860,Fact,The Cuban Missile Crisis was a 13-day confrontation between the United States and the Soviet Union over the placement of nuclear missiles in Cuba in 1962.,"The Cold War (1945 – 1991) was a period of political and military tension between the United States and the Soviet Union, resulting in the emergence of two distinct ideological blocs.",Fact,0.6008633375167847,The fall of the Soviet Union ended the Cold War.,Fact,0.5957717299461365,"The Cuban Revolution (1953 – 1959) was a period of political and social upheaval in Cuba, resulting in the overthrow of the Batista government and the establishment of a Communist state.",Fact,0.5688523054122925,The Space Race was an important part of the Cold War.,Fact,0.5232313871383667,"The Vietnam War (1955 – 1975) was a conflict between North and South Vietnam, resulting in the reunification of the country under a Communist government.",Fact,0.5140848159790039
861,Fact,The Rise of Populism (2016 – Present) has led to an emphasis on national identity and anti-immigrant rhetoric.,"Since the 2010s, far-right political parties have been gaining ground in many countries, fueled by xenophobia and anti-immigration sentiment.",Fact,0.5129740238189697,The rise of the Roman Empire established a unified political and cultural entity that would influence the world for centuries to come.,Fact,0.39770862460136414,The Frankfurt School of Marxist theorists has infiltrated the media and academia in order to promote multiculturalism and undermine white culture.,Conspiracy,0.386159211397171,There is an agenda to increase immigration for political reasons.,Controversy,0.3731723427772522,The fall of the Berlin Wall signaled an important shift in global politics.,Fact,0.35487139225006104
862,Fact,The war between the North and the South resulted in the abolishment of slavery and the reunification of the United States.,"The Vietnam War (1955 – 1975) was a conflict between North and South Vietnam, resulting in the reunification of the country under a Communist government.",Fact,0.5738816261291504,"The Emancipation Proclamation did not free all slaves in the United States, nor did it make slavery illegal in the United States; the Proclamation applied in the ten states that were still in rebellion in 1863.",Misconception,0.4895855188369751,"The War in Iraq was a military conflict between the United States and its allies, and Iraq from 2003 to 2011.",Fact,0.46524694561958313,World War II (1939-1945): The war between the Axis and Allied forces had a major impact on the world and led to the creation of the United Nations.,Fact,0.4512805640697479,The War in Iraq (2003 – 2011) resulted in the overthrow of the Saddam Hussein government and the withdrawal of U.S. forces.,Fact,0.44241654872894287
863,Fact,The Space Race was an important part of the Cold War.,The fall of the Soviet Union ended the Cold War.,Fact,0.672459065914154,"The Cold War (1945 – 1991) was a period of political and military tension between the United States and the Soviet Union, resulting in the emergence of two distinct ideological blocs.",Fact,0.5757449865341187,The Cuban Missile Crisis was a 13-day confrontation between the United States and the Soviet Union over the placement of nuclear missiles in Cuba in 1962.,Fact,0.5232313871383667,The fall of the Berlin Wall signaled an important shift in global politics.,Fact,0.5079566240310669,The moon landing was a hoax.,Conspiracy,0.448830783367157
