index,tags,text,top_sent_1,top_sent_tag_1,top_sent_score_1,top_sent_2,top_sent_tag_2,top_sent_score_2,top_sent_3,top_sent_tag_3,top_sent_score_3,top_sent_4,top_sent_tag_4,top_sent_score_4,top_sent_5,top_sent_tag_5,top_sent_score_5
539,Conspiracy,"The fashion trend of ""ripped denim"" jeans started as a means of communication, via specific forms of rips and holes, between agents of foreign states and their collaborators in Turkey.","The federal authorities routinely collect data on phone calls, emails and other electronic traffic that Americans generate, regardless of whether they have any bearing on a counterterrorism investigation.",Conspiracy,0.28868645429611206,Men in black is a term for men dressed in black suits who claim to be government agents and harass or threaten UFO witnesses or victims of alien abductions to keep them quiet about what they have seen.,Fiction,0.2786182463169098,Some UFO sightings and rumors are planned or staged in order to distract the public from real alien contact.,Conspiracy,0.2672092616558075,The Apollo‐moon landings were fake and filmed by Americans in a studio.,Conspiracy,0.2593252658843994,"The Government of China is engaged in espionage overseas, directed through diverse methods including cyber espionage to gain access to sensitive information remotely, signals intelligence, human intelligence as well as the exertion of political influence.",Conspiracy,0.2550719976425171
540,Conspiracy,Israel uses animals to conduct espionage or to attack people. Examples include shark attacks in Egypt in 2010 and the 2011 capture of a griffon vulture carrying an Israeli-labeled satellite tracking device.,"The chupacabra is an animal that has the habit of attacking and drinking the blood of livestock, especially goats.",Fiction,0.37820902466773987,"Government and military exercises (or ‘war games’) were intentionally held on September 11, 2001 to deliberately confuse military personnel and therefore to allow the attacks to take place.",Conspiracy,0.3533478081226349,The US government is planning to launch a false flag attack against Iran.,Conspiracy,0.34707769751548767,"Autonomous weapons, such as drones, are being developed by several countries since the 2010s, raising fears of a new arms race.",Fact,0.3459509015083313,"The Beast of Bladenboro (colloquially known as the Vampire Beast of Bladenboro or Vampire Cat) was a creature responsible for a string of deaths amongst Bladenboro, North Carolina animals in the winter of 1953–54.",Fiction,0.34389302134513855
541,Conspiracy,"Malala Yousafzai’s attempted murder by the Taliban in 2012 was a secret operation to further discredit the Taliban, and was organized by her father and the CIA and carried out by actor Robert de Niro disguised as an Uzbek homeopath.","Pakistan had kept bin Laden under house arrest since 2006, that the U.S. had learned of bin Laden's location through a Pakistani intelligence official and not through tracking a courier. Elements of the Pakistani military aided the U.S. in killing bin Laden.",Conspiracy,0.5135675072669983,"The leader of al-Qaeda, Osama bin Laden, was killed by U.S. forces in Pakistan in 2011, ending a decade-long manhunt.",Fact,0.48655858635902405,"Prime minister Benazir Bhutto  of Pakistan, through Pakistan's former top scientist, Abdul Qadeer Khan , supplied key data, stored on CDs, on uranium enrichment and information to North Korea in exchange for missile technology.",Conspiracy,0.42240220308303833,The CIA was involved in the assassination of Martin Luther King.,Conspiracy,0.4169332981109619,"Lee Harvey Oswald did not act alone in the assassination of President John F. Kennedy – FBI, CIA or the Mafia likely played a role.",Conspiracy,0.4123557209968567
542,Conspiracy,Catholic Church is actually a continuation of the pagan religion of ancient Babylon.,The Catholic Church is trying to keep the true origins of Christianity a secret.,Conspiracy,0.6285204887390137,The Church is suppressing evidence of ancient gods.,Conspiracy,0.6060997843742371,Emperor Constantine re-invented Christianity.,Conspiracy,0.45815640687942505,Ancient religions are based on extraterrestrial contact.,Conspiracy,0.4314085841178894,The Birth of Jesus (7 BCE) marks the beginning of Christianity and its spread throughout the world.,Fact,0.42324626445770264
543,Conspiracy,There is a massive Muslim plot to islamize Europe through mass immigration and high birth rates.,George Soros aimed to destroy the real Hungary through secret plots by increasing (Muslim) mass immigration to Hungary.,Conspiracy,0.5492126941680908,"immigration, integration, low fertility rates and abortion are being promoted in predominantly white countries in order to turn white people into a minority.",Conspiracy,0.5206403732299805,Asian immigrants are a threat to Western civilization.,Conspiracy,0.4625994861125946,There is an agenda to increase immigration for political reasons.,Controversy,0.4611722528934479,"In 2015-2017, there was a surge of people from the Middle East, Africa and South Asia seeking asylum in the European Union.",Fact,0.4287947416305542
544,Conspiracy,"immigration, integration, low fertility rates and abortion are being promoted in predominantly white countries in order to turn white people into a minority.",A conspiracy is taking place to replace white people with non-white immigrants.,Conspiracy,0.559969961643219,White people are being intentionally wiped out through immigration and interracial marriage.,Conspiracy,0.5366124510765076,There is a massive Muslim plot to islamize Europe through mass immigration and high birth rates.,Conspiracy,0.5206403732299805,"overpopulation is the primary threat to the environment and that the only solution is to completely halt immigration, or for the most extreme, eradicate minority groups and ethnicities.",Conspiracy,0.5121983289718628,Minority groups are racist towards white people.,Controversy,0.4699564278125763
545,Conspiracy,"The 2012 fatal mass shooting at Sandy Hook Elementary School in Newtown, Connecticut, was a manufactured event with the aim of promoting gun control.",Gun control is effective.,Controversy,0.48892977833747864,The United States has a historical fondness for guns. The United States ranked number one in gun ownership with a rate of 120.5 guns per 100 citizens in 2017.,Controversy,0.4406467378139496,Gun Control Laws are Essential to Public Safety.,Controversy,0.43215060234069824,Restrictions on gun ownership gives rise to violence.,Controversy,0.41235899925231934,Far more children died in 2013 drowning in their bathtubs than were killed accidentally by guns.,Misconception,0.39837321639060974
546,Conspiracy,"Once a disaster or threat of comes into being, martial law will be declared and FEMA's emergency powers will come into operation, and it will effectively become the government. The Constitution will be suspended, and citizens will be moved into camps.","The patriot movement in the US is a movement to support the government, authorities, and building trust in law enforcement.",Controversy,0.3762431740760803,The Patriot Act increases governments surveillance powers on individuals records held by third parties and searching property without warrant.,Controversy,0.36913973093032837,African Americans are planning to overthrow the government and enslave the white population.,Conspiracy,0.3658291697502136,Lockdown and vaccination are government means to control the masses.,Conspiracy,0.35775402188301086,"The government is involved in the murder of innocent citizens and/or well-known public figures, and keeps this a secret.",Conspiracy,0.3405182361602783
547,Conspiracy,"Because of violations of standard prison procedures and Epstein's knowledge of compromising information about famous individuals, he was murdered to prevent him from testifying against these powerful people with whom he associated.",High-level politicians have had certain people killed in order to prevent embarrassing events from becoming publicly known.,Conspiracy,0.3974236845970154,Watergate incident: Nixon had approved plans to cover up his administration's involvement in the break-in had later tried to use federal officials to deflect attention from the investigation.,Fact,0.3492162823677063,"There is no evidence at all to suggest that the American government monitors ordinary citizens indiscriminately, without adequate oversight and targeting.",Controversy,0.34188753366470337,The US government has been linked to the 9/11 attacks. It is said that there was advance knowledge of the attacks among high-level government officials. There are many inconsistencies in the official accounts and the current ongoing inquests are still uncovering new information that casts these accounts into serious doubt.,Conspiracy,0.3200376331806183,"It is said that there was advance knowledge of the 9/11 attacks among high-level government officials. However, there is no evidence to support this account and the current ongoing inquests are revealing only information that is consistent with the official statements.",Controversy,0.3150635063648224
548,Conspiracy,violent protestors are often funded by some very stupid rich people.,"Appalachian people are typically lawless, violent, and uneducated.",Stereotype,0.4843802750110626,violent video games cause people to become violent.,Misconception,0.3945349156856537,African Americans are violent.,Stereotype,0.3755061626434326,"George Soros is in control of a large portion of the world's wealth and governments, and he secretly funds a large range of persons and organizations for nefarious purposes.",Conspiracy,0.36703822016716003,"liberals are hippies, naive, and lacking in common sense.",Stereotype,0.35757163166999817
549,Conspiracy,Syrian refugees into the U.S. can be part of ISIS. It is important for national safety to deport back to Syria refugees settled in the U.S.,The US-Mexico border experienced a crisis in 2020 as thousands of migrants attempted to cross into the US.,Fact,0.49980291724205017,The Islamic State of Iraq and Syria (ISIS) is a terrorist organization that has gained notoriety for its brutality since 2014.,Fact,0.49920135736465454,An military operation led by the United States aimed at defeating ISIS in Iraq and Syria has been ongoing since 2014.,Fact,0.4981992244720459,The Syrian Civil War is a civil war in Syria between the forces of the Syrian government and those seeking to overthrow it since 2011.,Fact,0.45819026231765747,"ISIS was created by the United States and Israel, in order to create chaos in the Middle East and make Islam look bad.",Conspiracy,0.42512205243110657
550,Conspiracy,"The Mexican Government is forcing their most unwanted people into the United States. They are, in many cases, criminals, drug dealers, rapists, etc. Likewise, tremendous infectious disease is pouring across the border.",Hispanics are more likely to be in the country illegally.,Stereotype,0.43399858474731445,"A portion of criminals and social degenerates; drug dealers, crack addicts, hobos, and subway muggers are African American.",Stereotype,0.4110504388809204,Latinos are illegal immigrants.,Stereotype,0.37149015069007874,Illicit drugs such as heroin are deliberately spread through ethnic minority communities.,Conspiracy,0.3711361885070801,U.S. State Department is involved in drug trafficking and provides financial and material assistance to drug traffickers when law enforcement halts their working during investigations.,Conspiracy,0.35967907309532166
551,Conspiracy,"There is high possibility of adverse human health effects being in proximity of wind turbines.These effects include congenital abnormality, cancer, vertigo, nausia autism, ADHD, death, tinnitus, stress, fatigue, memory loss, attention defitist, vertigo, migraines and sleep deprivation.","People with Electromagnetic hypersensitivity have symptoms such as headache, fatigue, stress, sleep disturbances, skin prickling, burning sensations and rashes, pain and ache in muscles.",Controversy,0.4462929368019104,Leaky gut syndrome is a condition caused by the passage of harmful substances outward through the gut wall and may cause multiple sclerosis and autism.,Misconception,0.4203203320503235,Monosodium glutamate (MSG) triggers migraine headaches.,Misconception,0.39841967821121216,vaccines cause autism.,Conspiracy,0.32374048233032227,pharmaceutical industry has mounted a cover-up of a causal link between vaccines and autism.,Conspiracy,0.31815049052238464
552,Controversy,"Approximately 100,000 people in the United States have died, or are terminally ill, from asbestos exposure related to shipbuilding. Asbestos industry officials knew of asbestos dangers since the 1930s and had concealed them from the public.",Giant mutant killer hornets created by exposure to radiation from the Fukushima Daiichi nuclear disaster have killed several people in Nebraska.,Fiction,0.3987921178340912,cell phones emit dangerous levels of radiation and can cause cancer.,Misconception,0.39356696605682373,COVID-19 deaths are systematically overcounted. Only 6% of the reported deaths in the United States were actually from the disease.,Controversy,0.3528814911842346,Americans are reckless and imprudent people regarding the preservation of the environment. The United States (whose population is 327 million) has the second-highest carbon dioxide emissions after China (whose population is 1.4 billion).,Stereotype,0.32374563813209534,The Fukushima Daiichi Nuclear Disaster (2011) released radioactive material into the environment.,Fact,0.31661516427993774
553,Conspiracy,"Despite the severity of the impacts of Hurricane Maria, the Government of Puerto Rico initially reported that only 64 people died in the hurricane. Numerous media outlets harshly criticized the government for suppressing the true death toll.",Certain world leading political figures who died untimely deaths were in fact “taken out” by government operatives.,Conspiracy,0.37454941868782043,The US government covered up crucial information in the aftermath of J. F. Kennedy’s assassination.,Conspiracy,0.36878934502601624,"Pentagon explosion on 9/11 was caused by a missile, fired as the opening salvo of a coup d’etat by the military-industrial complex, rather than by American Airlines Flight 77.",Conspiracy,0.3455861806869507,COVID-19 deaths are systematically overcounted. Only 6% of the reported deaths in the United States were actually from the disease.,Controversy,0.3372122049331665,"In 2011, a nuclear accident at the Fukushima Daiichi Nuclear Power Plant in Japan was caused by an earthquake and tsunami.",Fact,0.3289424479007721
554,Conspiracy,LGBT rights movements are controlled by foreign forces like the European Union and are a threat to national independence and western civilization.,Asian immigrants are a threat to Western civilization.,Conspiracy,0.4846233129501343,Islamophobia is a violation of human rights and a threat to social cohesion.,Controversy,0.4689694046974182,Anti-government protests in Russia and the Euromaidan were the work of a LGBT conspiracy.,Conspiracy,0.38479459285736084,The rise of the Roman Empire established a unified political and cultural entity that would influence the world for centuries to come.,Fact,0.3811720311641693,The European Union is trying to take control of the United Kingdom.,Conspiracy,0.3611852824687958
555,Conspiracy,scientific consensus on global warming is based on conspiracies to produce manipulated data or suppress dissent for ideological or financial reasons.,the peer-review process for papers in climate science has become corrupted by scientists seeking to suppress dissent.,Conspiracy,0.5568414330482483,global warming is a deliberate fraud.,Conspiracy,0.5563343167304993,The science behind global warming has been invented or distorted out of self-interest.,Conspiracy,0.5427085161209106,Certain groups of scientists fabricate data in support of a particular scientific theory out of self-interest.,Conspiracy,0.4632170796394348,climate change is a hoax perpetrated by the Chinese.,Conspiracy,0.45836663246154785
556,Conspiracy,the peer-review process for papers in climate science has become corrupted by scientists seeking to suppress dissent.,scientific consensus on global warming is based on conspiracies to produce manipulated data or suppress dissent for ideological or financial reasons.,Conspiracy,0.5568414330482483,Certain groups of scientists fabricate data in support of a particular scientific theory out of self-interest.,Conspiracy,0.48870912194252014,NASA scientists fudged the numbers to make 1998 the hottest year to overstate the extent of global warming.,Controversy,0.44149646162986755,The science behind global warming has been invented or distorted out of self-interest.,Conspiracy,0.435837060213089,Government funded scientists manipulate evidence in order to support existing government policy.,Conspiracy,0.4289475083351135
557,Conspiracy,"because many people have invested in renewable-energy companies, they stand to lose a lot of money if global warming is shown to be a myth. Environmental groups therefore bribe climate scientists to doctor their data so that they are able to secure their financial investment in green energy.",NASA scientists fudged the numbers to make 1998 the hottest year to overstate the extent of global warming.,Controversy,0.47465062141418457,global warming is a deliberate fraud.,Conspiracy,0.4514167308807373,Al Gore is the best environmentalist.,Controversy,0.4399453401565552,Groups of scientists deliberately attempt to create panic about future risks because it is in their interests to do so.,Conspiracy,0.43662649393081665,scientific consensus on global warming is based on conspiracies to produce manipulated data or suppress dissent for ideological or financial reasons.,Conspiracy,0.4343453645706177
558,Conspiracy,The concept of global warming was created by and for the Chinese in order to make U.S. manufacturing non-competitive.,climate change is a hoax perpetrated by the Chinese.,Conspiracy,0.5449870824813843,the threat of global warming is an attempt to promote nuclear power.,Conspiracy,0.4904399812221527,The science behind global warming has been invented or distorted out of self-interest.,Conspiracy,0.4846232831478119,"In 2016, the world’s nations agreed to take action to reduce global warming.",Fact,0.4693288505077362,"In 2020, the world experienced record-breaking levels of global warming and climate change.",Fact,0.44840484857559204
559,Conspiracy,the threat of global warming is an attempt to promote nuclear power.,global warming is a deliberate fraud.,Conspiracy,0.6148549914360046,"In 2016, the world’s nations agreed to take action to reduce global warming.",Fact,0.5849155783653259,Climate Change is an Immediate Threat.,Fact,0.5360722541809082,"In 2020, the world experienced record-breaking levels of global warming and climate change.",Fact,0.496162086725235,The concept of global warming was created by and for the Chinese in order to make U.S. manufacturing non-competitive.,Conspiracy,0.4904399812221527
560,Controversy,COVID-19 deaths are systematically overcounted. Only 6% of the reported deaths in the United States were actually from the disease.,Far more children died in 2013 drowning in their bathtubs than were killed accidentally by guns.,Misconception,0.5541070699691772,Certain world leading political figures who died untimely deaths were in fact “taken out” by government operatives.,Conspiracy,0.513153076171875,The Black Death killed an estimated 50 million people in Europe.,Fact,0.44224584102630615,"United Airlines Flight 93, which is said to have crashed in Pennsylvania, was actually downed by the US military.",Conspiracy,0.4160212576389313,High-level politicians have had certain people killed in order to prevent embarrassing events from becoming publicly known.,Conspiracy,0.41368386149406433
561,Conspiracy,widespread electoral fraud occurred during the 2020 presidential election to deny incumbent President Donald Trump victory over former vice president Joe Biden.,the 2020 United States presidential election was rigged to favor Joe Biden using satellites and military technology to remotely switch votes from Donald Trump to Biden from the U.S. Embassy in Rome.,Conspiracy,0.7099470496177673,Joe Biden was officially sworn in as the 46th President of the United States in January 2021.,Fact,0.6112874150276184,"While Joe Biden was vice president of the United States, he engaged in corrupt activities relating to the employment of his son, Hunter Biden, by the Ukrainian gas company Burisma.",Conspiracy,0.5632357597351074,The 2020 US Election was tarnished by allegations of voter fraud and irregularities.,Fact,0.54570072889328,"In May 2018, the Obama administration had put a spy in President Donald Trump’s 2016 presidential campaign for political purposes.",Conspiracy,0.5120927691459656
562,Conspiracy,the 2020 United States presidential election was rigged to favor Joe Biden using satellites and military technology to remotely switch votes from Donald Trump to Biden from the U.S. Embassy in Rome.,widespread electoral fraud occurred during the 2020 presidential election to deny incumbent President Donald Trump victory over former vice president Joe Biden.,Conspiracy,0.7099470496177673,Joe Biden was officially sworn in as the 46th President of the United States in January 2021.,Fact,0.548313558101654,"While Joe Biden was vice president of the United States, he engaged in corrupt activities relating to the employment of his son, Hunter Biden, by the Ukrainian gas company Burisma.",Conspiracy,0.5477089285850525,"In May 2018, the Obama administration had put a spy in President Donald Trump’s 2016 presidential campaign for political purposes.",Conspiracy,0.4867597818374634,George Bush and other Republicans conspired with Iranian officials to delay the release of American hostages until after the 1980 elections.,Conspiracy,0.46210992336273193
563,Stereotype,All nurses are female.,male nurses are effeminate.,Stereotype,0.7057511210441589,Nurses are less-educated and work for physicians.,Stereotype,0.5815640687942505,males are generally better at mathematics than females.,Stereotype,0.36307191848754883,Men typically earn more than women in the same job.,Fact,0.3489173352718353,Women make up only about a quarter of all elected officials.,Fact,0.3284437358379364
564,Conspiracy,"Rafael Cruz, the father of Texas Senator and Republican presidential candidate for the 2016 elections Ted Cruz, had ties to Lee Harvey Oswald for the Assassination of John F. Kennedy.",Lee Harvey Oswald killed President Kennedy on his own.,Conspiracy,0.637207567691803,"Lee Harvey Oswald did not act alone in the assassination of President John F. Kennedy – FBI, CIA or the Mafia likely played a role.",Conspiracy,0.5321857333183289,President Kennedy was killed by an organized conspiracy.,Conspiracy,0.47948724031448364,Central Intelligence Agency was responsible for the assassination of President John F. Kennedy.,Conspiracy,0.47832944989204407,plane crash that killed Democrat Paul Wellstone was engineered by Republican politicians.,Conspiracy,0.462471604347229
565,Conspiracy,"In May 2018, the Obama administration had put a spy in President Donald Trump’s 2016 presidential campaign for political purposes.",former President Barack Obama's administration had wiretapped Donald Trump’s phones at his Trump Tower office late in the 2016 presidential campaign.,Conspiracy,0.7599736452102661,widespread electoral fraud occurred during the 2020 presidential election to deny incumbent President Donald Trump victory over former vice president Joe Biden.,Conspiracy,0.5120927691459656,the 2020 United States presidential election was rigged to favor Joe Biden using satellites and military technology to remotely switch votes from Donald Trump to Biden from the U.S. Embassy in Rome.,Conspiracy,0.4867597818374634,QAnon revealed the truth about Barak Obama and showed the world how Trump was really saving the world.,Conspiracy,0.4805629849433899,Hilary Clinton had sold weapons to ISIS.,Conspiracy,0.46396300196647644
566,Conspiracy,the use of pencils in UK voting stations in the lead-up to the EU membership referendum allowed for MI5 to erase the results of Brexit voters.,Brexit was the United Kingdom's decision to leave the European Union in 2016.,Fact,0.5765036344528198,The European Union is trying to take control of the United Kingdom.,Conspiracy,0.4256365895271301,SARS-CoV-2 (coronavirus) was created by the USA to disrupt the European Union so that they could subsequently “save it”.,Conspiracy,0.37955528497695923,"In 2017, the US Federal Communications Commission voted to repeal the Obama-era net neutrality rules.",Fact,0.36220502853393555,The 2020 US Election was tarnished by allegations of voter fraud and irregularities.,Fact,0.3354707956314087
567,Conspiracy,"French presidential candidate François Fillon had officially employed his wife Penelope as an aide while a politician, but it was a fictitious job which she never worked but nonetheless earned over €1 million in public wages.","Former U.S. President Bill Clinton and his wife Hillary Clinton have secretly had their political opponents murdered, totaling as many as 50 or more.",Conspiracy,0.3757385015487671,Former U.S. President Barack Obama was not born in the United States and was an illegal immigrant.,Conspiracy,0.339954674243927,Angela Merkel is the best politician.,Controversy,0.32917872071266174,Hillary Clinton is the best politician.,Controversy,0.31673550605773926,"President Obama had offered to pay out of his own pocket for the museum of Muslim culture, yet it's the Republican National Committee who's paying for this.",Misconception,0.31636664271354675
