index,tags,text,top_sent_1,top_sent_tag_1,top_sent_score_1,top_sent_2,top_sent_tag_2,top_sent_score_2,top_sent_3,top_sent_tag_3,top_sent_score_3,top_sent_4,top_sent_tag_4,top_sent_score_4,top_sent_5,top_sent_tag_5,top_sent_score_5
0,Conspiracy,Central Intelligence Agency was responsible for the assassination of President John F. Kennedy.,"Lee Harvey Oswald did not act alone in the assassination of President John F. Kennedy – FBI, CIA or the Mafia likely played a role.",Conspiracy,0.7001227140426636,The CIA was involved in the assassination of Martin Luther King.,Conspiracy,0.6554816961288452,The US government covered up crucial information in the aftermath of J. F. Kennedy’s assassination.,Conspiracy,0.6349619626998901,President Kennedy was killed by an organized conspiracy.,Conspiracy,0.6334152221679688,Lee Harvey Oswald killed President Kennedy on his own.,Conspiracy,0.6316932439804077
1,Conspiracy,the 1996 crash of TWA flight 800 was caused by a U.S. military missile.,"United Airlines Flight 93, which is said to have crashed in Pennsylvania, was actually downed by the US military.",Conspiracy,0.6673490405082703,"Pentagon explosion on 9/11 was caused by a missile, fired as the opening salvo of a coup d’etat by the military-industrial complex, rather than by American Airlines Flight 77.",Conspiracy,0.6408318281173706,"The Pentagon was not hit by a passenger aircraft but something smaller, possibly a missile.",Conspiracy,0.584027886390686,The US government is behind the disappearance of Malaysia Airlines Flight 370.,Conspiracy,0.5000461339950562,9/11 was purely a plane accident.,Conspiracy,0.4785391390323639
2,Conspiracy,plane crash that killed Democrat Paul Wellstone was engineered by Republican politicians.,George Bush and other Republicans conspired with Iranian officials to delay the release of American hostages until after the 1980 elections.,Conspiracy,0.4627513885498047,"Rafael Cruz, the father of Texas Senator and Republican presidential candidate for the 2016 elections Ted Cruz, had ties to Lee Harvey Oswald for the Assassination of John F. Kennedy.",Conspiracy,0.462471604347229,"The Watergate hotel room used by Democratic National Committee was bugged by Republican officials, operating at the behest of the White House.",Fact,0.45976176857948303,The health insurance industry is run mostly by Democrats.,Misconception,0.45060044527053833,Certain world leading political figures who died untimely deaths were in fact “taken out” by government operatives.,Conspiracy,0.4320127069950104
3,Conspiracy,"Martin Luther King, Jr., was killed by federal agents.","Martin Luther King, Jr. is the best civil rights leader.",Controversy,0.6917454600334167,Martin Luther King Jr. is the best social reformer.,Controversy,0.6489948630332947,The CIA was involved in the assassination of Martin Luther King.,Conspiracy,0.6486446261405945,Central Intelligence Agency was responsible for the assassination of President John F. Kennedy.,Conspiracy,0.453675776720047,President Kennedy was killed by an organized conspiracy.,Conspiracy,0.4530544877052307
4,Conspiracy,the Trilateral Commission is responsible for important movements of the international economy.,"A small, secret group of people is actually in control of the world economy.",Conspiracy,0.34741640090942383,The US government is behind the global financial crisis.,Controversy,0.3391513526439667,A secret society caled the Bilderberg Group is attempting to control global affairs.,Conspiracy,0.302315354347229,"A small, secret group of people is responsible for making all major world decisions, such as going to war.",Conspiracy,0.3021082282066345,The power held by heads of state is second to that of small unknown groups who really control world politics.,Conspiracy,0.30124762654304504
5,Conspiracy,global warming is a deliberate fraud.,the threat of global warming is an attempt to promote nuclear power.,Conspiracy,0.6148549914360046,Climate change is real and caused by human activity.,Fact,0.5678572654724121,The science behind global warming has been invented or distorted out of self-interest.,Conspiracy,0.5581434965133667,scientific consensus on global warming is based on conspiracies to produce manipulated data or suppress dissent for ideological or financial reasons.,Conspiracy,0.5563343167304993,climate change is a hoax perpetrated by the Chinese.,Conspiracy,0.5560500621795654
6,Conspiracy,doctors deliberately manufactured the AIDS virus as the product of a biowarfare program targeting gay people.,The government deliberately spread the AIDS virus in the homosexual community.,Conspiracy,0.6194690465927124,The AIDS virus was created deliberately in a government laboratory.,Conspiracy,0.5663779973983765,The HIV virus has been deliberately spread amongst groups such as homosexuals and African Americans.,Conspiracy,0.5601836442947388,The government deliberately spread the AIDS virus in the black community.,Conspiracy,0.5520645976066589,"HIV was deliberately created by humans in the laboratory, and the pharmaceutical industry promotes the HIV hypothesis to sell expensive yet harmful antiretroviral drugs.",Conspiracy,0.48017385601997375
7,Fact,"The Watergate hotel room used by Democratic National Committee was bugged by Republican officials, operating at the behest of the White House.",Watergate incident: Nixon had approved plans to cover up his administration's involvement in the break-in had later tried to use federal officials to deflect attention from the investigation.,Fact,0.5771017074584961,plane crash that killed Democrat Paul Wellstone was engineered by Republican politicians.,Conspiracy,0.45976176857948303,George Bush and other Republicans conspired with Iranian officials to delay the release of American hostages until after the 1980 elections.,Conspiracy,0.44957104325294495,former President Barack Obama's administration had wiretapped Donald Trump’s phones at his Trump Tower office late in the 2016 presidential campaign.,Conspiracy,0.4486673176288605,"In May 2018, the Obama administration had put a spy in President Donald Trump’s 2016 presidential campaign for political purposes.",Conspiracy,0.43356573581695557
8,Fact,"In the 1950s, the Central Intelligence Agency administered LSD and related drugs under Project MKULTRA, in an effort to investigate the possibility of “mind control”.",Drug companies falsify their data on the effectiveness of their drugs.,Controversy,0.4348165690898895,The CIA is involved in drug trafficking.,Conspiracy,0.4220741093158722,Drug companies call normal behaviour a disorder so they can invent drugs to cure it.,Controversy,0.39753732085227966,The mass suicide of Jonestown was actually a CIA-backed exercise in mind control and brainwashing.,Conspiracy,0.39379578828811646,The government is using mind control to manipulate people.,Conspiracy,0.3865717053413391
9,Fact,"Operation Northwoods, a rumored plan by the Department of Defense to simulate acts of terrorism and to blame them on Cuba, really was proposed by high-level officials (though the plan never went into effect).",The 9/11 attack was staged by the government.,Conspiracy,0.44177454710006714,Government agencies have been secretly involved in the assassination of their own citizens.,Conspiracy,0.4365626573562622,"Government and military exercises (or ‘war games’) were intentionally held on September 11, 2001 to deliberately confuse military personnel and therefore to allow the attacks to take place.",Conspiracy,0.4135831892490387,"Pentagon explosion on 9/11 was caused by a missile, fired as the opening salvo of a coup d’etat by the military-industrial complex, rather than by American Airlines Flight 77.",Conspiracy,0.4087773561477661,Reports that some of the 9/11 plane hijackers are still alive prove that others were responsible for the attacks.,Conspiracy,0.4015379250049591
10,Fiction,"a secret group of elves, working in a remote location under the leadership of the mysterious “Santa Claus,” make and distribute presents on Christmas Eve.",Santa Claus lives at the North Pole.,Fiction,0.5462909936904907,The common image of Santa Claus as a jolly old man in red robes was created by The Coca-Cola Company.,Misconception,0.40955668687820435,There is a attack on Christian traditions during the holiday season.,Controversy,0.391062468290329,Xmas originated as a secular plan to take the Christ out of Christmas.,Misconception,0.37889939546585083,"A small, secret group of people is actually in control of the world economy.",Conspiracy,0.35818400979042053
11,Fiction,Easter Bunny is real.,The Easter Bunny delivers eggs on Easter morning.,Fiction,0.6814455986022949,The Loch Ness monster is real.,Fiction,0.5248036980628967,Dragons are real.,Fiction,0.44962167739868164,"Bunny Man was a man wearing a rabbit costume (""bunny suit"") who attacks people with an axe.",Fiction,0.4492538571357727,Harry Potter is a real person.,Fiction,0.42605873942375183
12,Fiction,Toot faity is real and leaves pennies in exchange of tooth when the tooth are kept under the pillow at night.,Ostriches stick their heads in the sand to hide from enemies or to sleep.,Misconception,0.3523256480693817,The ghost boy of Clinton Road is a dead young boy who hangs out under a bridge and returns coins to you after you throw them in the water.,Fiction,0.2928354740142822,A vampire is a real creature that subsists by feeding on the vital essence (generally in the form of blood) of the living. They typically live in isolate forests.,Fiction,0.28908634185791016,El Trauco is a repulsive dwarf-like creature with hypnotic powers that is known to prey on and impregnate unmarried women.,Fiction,0.27769166231155396,Unicorns exist.,Fiction,0.2700909972190857
13,Controversy,prolonged exposure to sunlight is actually healthy.,cell phones emit dangerous levels of radiation and can cause cancer.,Misconception,0.35340365767478943,"Regular consumption of Red Bull raises dopamine levels, which causes damage in the long term.",Conspiracy,0.3282959759235382,Sunflowers point to the Sun.,Misconception,0.32754382491111755,Commercials in sports give the impression that Red Bull is healthy.,Conspiracy,0.3001725971698761,The average human life span is around 78 years.,Fact,0.296679824590683
14,Conspiracy,climate change is neither occurring nor likely to occur.,Climate Change is an Immediate Threat.,Fact,0.6251338124275208,climate change is a hoax perpetrated by the Chinese.,Conspiracy,0.5781402587890625,Climate change is real and caused by human activity.,Fact,0.5642422437667847,"In 2020, the world experienced record-breaking levels of global warming and climate change.",Fact,0.5372161269187927,The science behind global warming has been invented or distorted out of self-interest.,Conspiracy,0.5262317657470703
15,Conspiracy,World War II did not happened.,The Holocaust never happened.,Conspiracy,0.592908501625061,World War II (1939-1945): The war between the Axis and Allied forces had a major impact on the world and led to the creation of the United Nations.,Fact,0.5069290399551392,The Holocaust has been grossly exaggerated.,Conspiracy,0.4555836319923401,Adolf Hitler had committed suicide.,Fact,0.41460224986076355,"Hitler and Braun did not commit suicide, but actually escaped to Argentina.",Conspiracy,0.3970593214035034
16,Fiction,Marilyn Monroe was more ‘real’ than King Kong or Donald Duck.,"Marilyn Monroe and Robert F. Kennedy had an affair and she was killed by either the FBI or the CIA, who wished to use the murder as a ""point of pressure” against the Kennedys.",Conspiracy,0.47124412655830383,Marilyn Monroe’s death was part of a communist conspiracy.,Conspiracy,0.4383484721183777,"Lee Harvey Oswald did not act alone in the assassination of President John F. Kennedy – FBI, CIA or the Mafia likely played a role.",Conspiracy,0.3934937119483948,Walt Disney is the best cartoonist.,Controversy,0.3913820683956146,Lee Harvey Oswald killed President Kennedy on his own.,Conspiracy,0.3653009235858917
17,Conspiracy,"Pentagon explosion on 9/11 was caused by a missile, fired as the opening salvo of a coup d’etat by the military-industrial complex, rather than by American Airlines Flight 77.","The Pentagon was not hit by a passenger aircraft but something smaller, possibly a missile.",Conspiracy,0.6580684781074524,the 1996 crash of TWA flight 800 was caused by a U.S. military missile.,Conspiracy,0.6408318281173706,Intact windows at the Pentagon and a lack of debris prove that the Pentagon was not hit by an aircraft.,Conspiracy,0.6049495339393616,"United Airlines Flight 93, which is said to have crashed in Pennsylvania, was actually downed by the US military.",Conspiracy,0.5646848082542419,9/11 was purely a plane accident.,Conspiracy,0.5400578379631042
18,Conspiracy,Lee Harvey Oswald killed President Kennedy on his own.,"Lee Harvey Oswald did not act alone in the assassination of President John F. Kennedy – FBI, CIA or the Mafia likely played a role.",Conspiracy,0.7625187635421753,President Kennedy was killed by an organized conspiracy.,Conspiracy,0.6989327669143677,"Rafael Cruz, the father of Texas Senator and Republican presidential candidate for the 2016 elections Ted Cruz, had ties to Lee Harvey Oswald for the Assassination of John F. Kennedy.",Conspiracy,0.637207567691803,"Marilyn Monroe and Robert F. Kennedy had an affair and she was killed by either the FBI or the CIA, who wished to use the murder as a ""point of pressure” against the Kennedys.",Conspiracy,0.6353563666343689,Central Intelligence Agency was responsible for the assassination of President John F. Kennedy.,Conspiracy,0.6316932439804077
19,Conspiracy,9/11 was purely a plane accident.,Reports that some of the 9/11 plane hijackers are still alive prove that others were responsible for the attacks.,Conspiracy,0.6060147881507874,The 9/11 attack was staged by the government.,Conspiracy,0.5884140133857727,The fact that the US government is withholding information about the 9/11 attacks is evidence of a cover-up.,Conspiracy,0.577158510684967,The World Trade Centre towers were brought down by a controlled demolition.,Conspiracy,0.5645676255226135,"United Airlines Flight 93, which is said to have crashed in Pennsylvania, was actually downed by the US military.",Conspiracy,0.5425551533699036
20,Controversy,secret service agencies routinely violate privacy laws.,Government agencies secretly keep certain outspoken celebrities and citizens under constant surveillance.,Conspiracy,0.5459381937980652,Government Surveillance is Unethical.,Controversy,0.4633694887161255,Government agencies have been secretly involved in the assassination of their own citizens.,Conspiracy,0.4603939354419708,The Patriot Act increases governments surveillance powers on individuals records held by third parties and searching property without warrant.,Controversy,0.40824970602989197,"Secret organizations communicate with extra terrestrials, but keep this fact from the public.",Conspiracy,0.40209710597991943
21,Fact,Watergate incident: Nixon had approved plans to cover up his administration's involvement in the break-in had later tried to use federal officials to deflect attention from the investigation.,"The Watergate hotel room used by Democratic National Committee was bugged by Republican officials, operating at the behest of the White House.",Fact,0.5771017074584961,Bangabandhu is described as the proclaimer of the independence  of Bangladesh  in all diplomatic secret documents of the Richard Nixon administration.,Fact,0.48605069518089294,The United States federal government intentionally covered up crucial information in the aftermath of JFK assassination to prevent the conspiracy from being discovered.,Conspiracy,0.4778588116168976,Officials investigating the 9/11 attacks have sought to suppress the emergence of evidence that might contradict the ‘official account’.,Conspiracy,0.453250527381897,former President Barack Obama's administration had wiretapped Donald Trump’s phones at his Trump Tower office late in the 2016 presidential campaign.,Conspiracy,0.4038718342781067
22,Fact,There were incidents of corporate corruption in the US.,"Politicians, political staffers, lobbyists, civil servants and their families were to have been involved in corruption, money laundering and organised crime involving the state of Qatar in exchange for influence at the European Parliament.",Conspiracy,0.4296930432319641,"police officers are corrupt, aggressive, and abuse their power.",Stereotype,0.42106398940086365,Many of the major events in recent world history have been caused by a Jewish conspiracy.,Conspiracy,0.38007134199142456,The American government is controlled by a cabal of bankers.,Controversy,0.364212304353714,The US government deliberately conceals a lot of information from the public.,Controversy,0.34982749819755554
23,Conspiracy,climate change is a hoax perpetrated by the Chinese.,Climate change is real and caused by human activity.,Fact,0.6767393946647644,climate change is neither occurring nor likely to occur.,Conspiracy,0.5781402587890625,Climate Change is an Immediate Threat.,Fact,0.5751197934150696,global warming is a deliberate fraud.,Conspiracy,0.5560500621795654,The concept of global warming was created by and for the Chinese in order to make U.S. manufacturing non-competitive.,Conspiracy,0.5449870824813843
24,Conspiracy,vaccines cause autism.,Vaccines are a form of population control.,Conspiracy,0.6495375037193298,Vaccines are safe and effective.,Fact,0.6202458143234253,pharmaceutical industry has mounted a cover-up of a causal link between vaccines and autism.,Conspiracy,0.6127407550811768,Vaccinations are an Essential Part of Public Health.,Fact,0.5009639859199524,Giving many vaccines at once may overwhelm or weaken a child's immature immune system and lead to adverse effects.,Misconception,0.47945931553840637
25,Conspiracy,Contraceptives are a form of Black genocide. They are intended to eradicate Black people.,African Americans are planning to overthrow the government and enslave the white population.,Conspiracy,0.4892948269844055,"Support for Black lives matter movement is decreasing among Whites, Hispanics, and even among African Americans.",Stereotype,0.4676693081855774,The United States federal government  deliberately targeted Black Lives Matter protesters in an attempt to disrupt and discourage the Black Lives Matter movement during the summer of 2020.,Stereotype,0.46126917004585266,Minority groups are racist towards white people.,Controversy,0.4498932659626007,The government deliberately spread the AIDS virus in the black community.,Conspiracy,0.4387465715408325
26,Conspiracy,"HIV was deliberately created by humans in the laboratory, and the pharmaceutical industry promotes the HIV hypothesis to sell expensive yet harmful antiretroviral drugs.",The pharmaceutical industry administers harmful treatments without people’s consent in order to keep people sick and boost drug sales.,Conspiracy,0.558836817741394,"COVID-19 (coronavirus) is only a fabrication, it is an ordinary flu that pharmaceutical companies rebranded to increase the sales of drugs.",Conspiracy,0.5188166499137878,The AIDS virus was created deliberately in a government laboratory.,Conspiracy,0.5056005716323853,doctors deliberately manufactured the AIDS virus as the product of a biowarfare program targeting gay people.,Conspiracy,0.48017385601997375,The HIV virus has been deliberately spread amongst groups such as homosexuals and African Americans.,Conspiracy,0.4763789474964142
27,Conspiracy,condom use causes HIV infections.,The HIV virus has been deliberately spread amongst groups such as homosexuals and African Americans.,Conspiracy,0.4393256902694702,The AIDS virus was created deliberately in a government laboratory.,Conspiracy,0.4363538324832916,"HIV was deliberately created by humans in the laboratory, and the pharmaceutical industry promotes the HIV hypothesis to sell expensive yet harmful antiretroviral drugs.",Conspiracy,0.41703012585639954,The US government is behind the spread of AIDS in Africa.,Conspiracy,0.3987247943878174,The government deliberately spread the AIDS virus in the homosexual community.,Conspiracy,0.38832905888557434
28,Conspiracy,Nero and his loyal servants deliberately had ignited the great fire of Rome in the year 64 AD.,The Great Fire of London in 1666 was started by an arsonist.,Controversy,0.41524219512939453,The assassination of Julius Caesar was a conspiracy orchestrated by Marcus Brutus and other Roman senators.,Conspiracy,0.406994104385376,The rise of the Roman Empire established a unified political and cultural entity that would influence the world for centuries to come.,Fact,0.3497716784477234,Julius Caesar is the best military leader.,Controversy,0.34837231040000916,The Roman Empire stretched from Britain to the Middle East in its heyday.,Fact,0.33768293261528015
29,Conspiracy,There are young women who conspire with the Devil and therefore need to be burnt alive.,The musical interval tritone was thought to summon the devil and was banned by the Catholic Church.,Misconception,0.3979414701461792,Satanists regularly sexually abuse and murder children in their rites.,Controversy,0.3930423855781555,"Cures for certain deadly and common diseases exist, but are being deliberately withheld.",Conspiracy,0.36974000930786133,The Salem Witch Trials were an example of mass hysteria and scapegoating.,Controversy,0.36176466941833496,There is no good data showing secondhand smoke kills people.,Misconception,0.3434547781944275
30,Conspiracy,Modern technology is a form of sorcery designed by hostile Western plots to harm or control others.,technology is inherently evil or detrimental to society.,Misconception,0.44687995314598083,New and better technology is suppressed by those whose current business would be disrupted by it.,Conspiracy,0.36665964126586914,Advanced technology is secretly used to placate the people and suppress dissent.,Conspiracy,0.35579806566238403,"The human mind can be altered or controlled by certain psychological techniques making them cooperate in certain actions, sometimes illegal.",Controversy,0.35318005084991455,Witches and wizards can cast spells.,Fiction,0.32777515053749084
31,Conspiracy,Testing for COVID-19 is a means to inserting microchips into our brain.,Barcodes on everyday products are used by the government to track and spy on its citizens.,Conspiracy,0.34563905000686646,The New Zealand government uses any means possible to spy on its citizens.,Conspiracy,0.33264991641044617,The holographic principle states that the universe can be viewed as a two-dimensional hologram.,Fact,0.3320392668247223,"In the 1950s, the Central Intelligence Agency administered LSD and related drugs under Project MKULTRA, in an effort to investigate the possibility of “mind control”.",Fact,0.3135942220687866,Fluoridated drinking water is a ploy to control minds.,Conspiracy,0.31260427832603455
32,Conspiracy,Lockdown and vaccination are government means to control the masses.,Governments want to use compulsory vaccination against COVID-19 to achieve monitoring of the population.,Conspiracy,0.6039736866950989,Vaccines are a form of population control.,Conspiracy,0.5895678400993347,The government is using mind control to manipulate people.,Conspiracy,0.5080627799034119,Vaccinations are an Essential Part of Public Health.,Fact,0.4562644064426422,The government withholds a lot of information about diseases and their treatments from the public.,Conspiracy,0.4375850260257721
33,Conspiracy,COVID-19 is a biological weapon intended to eliminate the overcrowded human population.,The HIV/aids virus has been genetically engineered to wipe out certain sectors of the population.,Conspiracy,0.4624336063861847,Vaccines are a form of population control.,Conspiracy,0.45798999071121216,COVID-19 pandemic is intentionally used for the genocide of domestic population to make a room for migrants to move in.,Conspiracy,0.45501378178596497,Human population growth is decreasing and the world population is expected to peak and then begin falling during the 21st century.,Misconception,0.44978368282318115,"overpopulation is the primary threat to the environment and that the only solution is to completely halt immigration, or for the most extreme, eradicate minority groups and ethnicities.",Conspiracy,0.44227927923202515
34,Conspiracy,"COVID-19 (coronavirus) is only a fabrication, it is an ordinary flu that pharmaceutical companies rebranded to increase the sales of drugs.",SARS-CoV-2 (coronavirus) is artificially created to increase people’s dependency on the pharmaceutical business.,Conspiracy,0.5976811647415161,The pharmaceutical industry administers harmful treatments without people’s consent in order to keep people sick and boost drug sales.,Conspiracy,0.548410952091217,"HIV was deliberately created by humans in the laboratory, and the pharmaceutical industry promotes the HIV hypothesis to sell expensive yet harmful antiretroviral drugs.",Conspiracy,0.5188166499137878,Pharmaceutical companies and various government agencies conspire to maintain profits by ensuring that the general public uses only conventional medicine.,Conspiracy,0.4857771694660187,The Food and Drug Administration deliberately suppresses natural cures due to influence from the pharmaceutical industry.,Conspiracy,0.47513020038604736
